{
 "esquema": "arbol-impacto",
 "version": "0.2",
 "caso": {
  "id": "carrera-1997",
  "titulo": "Grafo de la carrera: el impacto del doctor (Doctorado UNS 1997)",
  "autor": "Guillermo Blas Sentoni",
  "orcid": "0009-0006-9088-3717",
  "raiz": "doc97",
  "fecha_corte": "2026-10-02",
  "construccion": {
   "construido_por": "Claude, a partir del CVar, del árbol del autor y de fuentes públicas",
   "verificado_por": "Pendiente: verificación por un tercero",
   "horas_estimadas": null,
   "notas": "Segundo grafo para la charla RADoI del 16/10/2026. No modifica los números del grafo de la tesis. Donde el árbol y la fuente pública difieren (superficie del CeDIT, horas de viaje), manda la fuente pública."
  }
 },
 "fuentes": [
  {
   "id": "F-tesis",
   "tipo": "tesis",
   "cita": "Sentoni, G. B. LNET: una estructura de aproximación para sistemas no lineales discretos. Tesis de doctorado en Control de Sistemas, Universidad Nacional del Sur, 1997. Dir.: O. Agamennoni.",
   "fecha": "1997"
  },
  {
   "id": "F-cvar",
   "tipo": "registro_cv",
   "cita": "CVar (Ministerio de Ciencia, Tecnología e Innovación), Sentoni, Guillermo Blas. Generado el 13/03/2024. Cargos de gestión, dirección de laboratorios, proyectos de transferencia, formación de recursos humanos, premios, prensa. Archivo del autor (autodeclarado).",
   "fecha": "2024-03-13"
  },
  {
   "id": "F-arbol",
   "tipo": "testimonio",
   "cita": "Árbol interactivo de la carrera (pestaña 'Career' de lnet-arbol-corregido.html), redactado por el autor.",
   "fecha": "2026"
  },
  {
   "id": "F-cedit",
   "tipo": "pagina_producto",
   "cita": "CeDIT UNLaM, 'Quiénes somos': espacio de encuentro academia-industria; becarios trabajan en proyectos de empresas dentro de la universidad; viajes de hasta 3 horas diarias y deserción como problemas que atiende; Premio Sadosky a la Calidad e Innovación Educativa y Premio LaTinaTec a la Innovación Educativa.",
   "url": "https://cedit.unlam.edu.ar/quienes-somos.php",
   "fecha": "2026-10-02"
  },
  {
   "id": "F-gob2017",
   "tipo": "comunicado",
   "cita": "Gobierno de la Nación Argentina, 'Cómo funcionará el nuevo Polo Tecnológico en la UNLaM', 13/11/2017: inauguración del CeDIT, 2.200 m², 20 empresas previstas, 200 estudiantes por turno.",
   "url": "https://www.argentina.gob.ar/noticias/como-funcionara-el-nuevo-polo-tecnologico-en-la-unlam",
   "fecha": "2017-11-13"
  },
  {
   "id": "F-lme2017",
   "tipo": "prensa_sectorial",
   "cita": "La Matanza Empresas, 'Cómo funciona el primer polo tecnológico universitario del país', 22/11/2017: más de 70 becarios, casi una docena de empresas incubadas; Premio LaTinaTec 2015 (La Habana) y Premio Sadosky 2015 (CESSI).",
   "url": "https://lamatanzaempresas.com.ar/como-funciona-el-primer-polo-tecnologico-universitario-del-pais/",
   "fecha": "2017-11-22"
  },
  {
   "id": "F-jui2014",
   "tipo": "comunicado",
   "cita": "Programa de las 43 JAIIO (SADIO, 2014), comité de las JUI 2014: 'Sentoni, Guillermo (Sec. de Inv. y Transf. – Esc. de Ciencia y Tec. - UNSAM)'.",
   "url": "https://43jaiio.sadio.org.ar/sites/default/files/Programa%2043%20JAIIO.pdf",
   "fecha": "2014"
  },
  {
   "id": "F-unsam-dipl",
   "tipo": "comunicado",
   "cita": "Noticias UNSAM, 'Diplomatura Universitaria en Software Testing', 16/10/2012. Verificado el título y la fecha; el cuerpo no fue accesible desde el entorno de trabajo.",
   "url": "https://noticias.unsam.edu.ar/2012/10/16/diplomatura-universitaria-en-software-testing/",
   "fecha": "2012-10-16"
  },
  {
   "id": "F-unsam-sad",
   "tipo": "comunicado",
   "cita": "Noticias UNSAM, 'Los medios hablan del Premio Sadosky a la Inclusión Digital', 05/11/2012: 'La entrega del premio a la Diplomatura en Software Testing del Centro Universitario San Martín (CUSAM), que funciona en la Unidad Penitenciaria Nº 48 [...] fue elegida en la 12º edición de los premios que entrega la Cámara de Empresas de Software y Servicios Informáticos de Argentina como la mejor experiencia de inclusión digital.' Enlaza notas de Télam, iProfesional, Canal AR y otros medios.",
   "url": "https://noticias.unsam.edu.ar/2012/11/05/los-medios-hablan-del-premio-sadosky-a-la-inclusion-digital/",
   "fecha": "2012-11-05"
  },
  {
   "id": "F-microlab",
   "tipo": "pagina_producto",
   "cita": "UNSAM, 'MICROLAB. Laboratorio para caracterización de elementos MEM' (página institucional de la ECyT). Verificado el título; el cuerpo no fue accesible.",
   "url": "http://www.unsam.edu.ar/escuelas/ciencia/microlab/vision.htm"
  },
  {
   "id": "F-microlab2018",
   "tipo": "comunicado",
   "cita": "Noticias UNSAM, 'Nuevo espacio para desarrollos electrónicos en el MicroLab', 24/04/2018 (el laboratorio sigue activo en 2018). Verificado el título.",
   "url": "https://noticias.unsam.edu.ar/2018/04/24/nuevo-espacio-para-desarrollos-electronicos-en-el-microlab/",
   "fecha": "2018-04-24"
  },
  {
   "id": "F-cma2011",
   "tipo": "articulo",
   "cita": "Merletti, G.; Bonaparte, J.; Sentoni, G. 'Medición y análisis estadístico para la caracterización de RF-MEMS'. II Congreso de Microelectrónica Aplicada, UNLP, 2011; y Sentoni, G. 'Microlab, un caso de laboratorios con cuartos limpios'. I Congreso de Microelectrónica Aplicada, UNLaM, 2011 (ambos listados en el CVar; actas del II CMA en SEDICI, no leídas).",
   "url": "http://sedici.unlp.edu.ar/bitstream/handle/10915/121961/Documento_completo.pdf?sequence=1",
   "fecha": "2011"
  },
  {
   "id": "F-tesis-tercero2023",
   "tipo": "capitulo",
   "cita": "Blanco, G. e Ynsfran, B. P. 'El Centro de Desarrollo Tecnológico del DIIT-UNLaM en el Conurbano Bonaerense y su influencia en la graduación', cap. 31, pp. 727–755 (Repositorio CyT UNLaM). Extracto de la tesis doctoral de G. Blanco, 'Centro de desarrollo tecnológico del conurbano bonaerense y su impacto en la carrera de ingeniería informática' (UNTREF, 2023); un tercero, sin relación con el autor. Encuestas y entrevistas: 95% de los becarios valora positiva la experiencia; 86% considera que el modelo mejora el rendimiento académico; 150 a 200 alumnos y 20 a 30 empresas; concluye que el centro 'colabora con minimizar el desgranamiento'. No mide tasas de graduación ni nombra a los creadores del centro.",
   "url": "https://repositoriocyt.unlam.edu.ar/bitstream/123456789/2408/1/El%20Centro%20de%20Desarrollo%20Tecnol%C3%B3gico%20del%20DIIT-UNLaM%20en%20%20el%20Conurbano%20Bonaerense%20y%20su%20influencia%20%20en%20la%20graduaci%C3%B3n.pdf",
   "fecha": "2023"
  },
  {
   "id": "F-cessi2014",
   "tipo": "capitulo",
   "cita": "CESSI, Historia de la Industria Informática Argentina, ed. I. Daffra, Buenos Aires, 2014, ISBN 978-987-22152-8-6, p. 132 (Universidad Nacional de San Martín). Autoridades: 'Secretario de Inv. Tran.: Doctor Guillermo Sentoni'. En la misma página: 'Dictado de la Diplomatura de Software Testing en Entornos de Encierro (Premio Sadosky 2012, temática Inclusión Digital)', que 'se desarrolla en forma física en el Centro de Estudios Universitarios de la Unidad Penitenciaria N.º 48, CUSAM' y 'beneficia, tanto la adquisición de conocimientos y la reinserción de las personas en contexto de encierro, como el acrecentamiento de los lazos de la universidad con el medio social'. Esa descripción reproduce casi textualmente la nota del autor de 2012 (F-carta-cusam2012): no es una evaluación independiente.",
   "fecha": "2014"
  },
  {
   "id": "F-unsam-tecnopolis",
   "tipo": "comunicado",
   "cita": "Noticias UNSAM, 'Ciencia y Tecnología: la UNSAM ganó el premio Sadosky', 02/11/2012, por Paula Bistagnino: 'La iniciativa fue ideada por el doctor Guillermo Sentoni, secretario de Investigación y Transferencia de la Escuela de Ciencia y Tecnología de la UNSAM, y se puso en marcha a principios de 2012 con la empresa Liveware Is. Sa.' Sentoni recibió el premio el 01/11/2012 en Tecnópolis. Programa de tres meses, 'que a fin de año tendrá a sus primeros egresados'; los participantes 'podrán continuar desarrollando software testing en el penal como actividad rentada o estudiar una tecnicatura universitaria en programación'.",
   "url": "https://noticias.unsam.edu.ar/2012/11/02/tecnopolis-la-unsam-gano-el-premio-sadosky-en-inclusion-digital/",
   "fecha": "2012-11-02"
  },
  {
   "id": "F-foto-sadosky2012",
   "tipo": "comunicado",
   "cita": "Fotografía de la entrega de los Premios Sadosky 2012 en Tecnópolis, publicada en la nota de Noticias UNSAM del 02/11/2012 ('Fotos gentileza CESSI').",
   "url": "https://noticias.unsam.edu.ar/2012/11/02/tecnopolis-la-unsam-gano-el-premio-sadosky-en-inclusion-digital/",
   "fecha": "2012-11-01"
  },
  {
   "id": "F-reddi2016",
   "tipo": "articulo",
   "cita": "'Creación del Polo Tecnológico: Centro de Desarrollo de Tecnología de la Información y las Comunicaciones (CDTIC)', ReDDI, Revista Digital del DIIT-UNLaM, vol. 1, n.º 1, mayo de 2016 (fechado 04/04/2016). Sin firma en el texto; según el autor, lo escribió él. Dice: en 2011 la UNLaM firmó con el Ministerio de Producción bonaerense un convenio marco para construir un Polo Tecnológico 'pensado como el primer CDTIC en la zona', gestionado por la UNLaM y la CESSI; edificio de unos 4.200 m²; objetivo: más graduados y menos deserción por traslados; meta de 240 estudiantes; desde 2014 cuatro empresas y, a abril de 2016, unos veinte estudiantes trabajando en instalaciones provisorias. Al ser texto del propio autor, sus afirmaciones de impacto no son una evaluación independiente.",
   "url": "https://reddi.unlam.edu.ar/index.php/ReDDi/article/download/5/36?inline=1",
   "fecha": "2016-04-04"
  },
  {
   "id": "F-acta-ecyt2012",
   "tipo": "acta",